<?xml version="1.0" encoding="UTF-8"?>
<xs:schema xmlns:xs="http://www.w3.org/2001/XMLSchema">

  <xs:element name="howto">
     <xs:complexType>
      <xs:sequence>
        <xs:element name="topic" maxOccurs="unbounded">
          <xs:complexType>
            <xs:sequence>
              <xs:element name="title" type="xs:string"/>
              <xs:element name="url" type="httpURI"/>
            </xs:sequence>
          </xs:complexType>
        </xs:element>
      </xs:sequence>
    </xs:complexType>
  </xs:element>
  
  <xs:simpleType name="httpURI">
      <xs:restriction base="xs:anyURI">
        <xs:pattern value="http://.*" />
      </xs:restriction>
  </xs:simpleType>
 
</xs:schema>
