<?xml version="1.0" encoding="UTF-8"?>
<howto xsi:noNamespaceSchemaLocation="howto.xsd"
       xmlns:xsi="http://www.w3.org/2001/XMLSchema-instance">
  <topic>
      <title>Java</title>
      <url>http://www.rgagnon.com/topics/java-xml.html</url>
  </topic>
  <topic>
      <title>PowerBuilder</title>
      <url>http://www.rgagnon.com/topics/pb-powerscript.htm</url>
  </topic>
  <topic>
        <title>Javascript</title>
        <url>http://www.rgagnon.com/topics/js-language.html</url>
  </topic>
  <topic>
        <title>VBScript</title>
        <url>http://www.rgagnon.com/topics/wsh-vbs.html</url>
  </topic>
</howto>

